{
  "$schema": "https://json-schema.org/draft/2020-12/schema",
  "$id": "https://raw.githubusercontent.com/jeremiah-k/medre/main/docs/schemas/delivery-receipt.schema.json",
  "title": "DeliveryReceipt",
  "description": "Per-adapter delivery status record for an outbound event. Tracks the lifecycle of an event as it travels through the delivery pipeline toward a target adapter. Derived from msgspec.Struct with frozen=True.",
  "type": "object",
  "properties": {
    "sequence": {
      "type": "integer",
      "default": 0,
      "description": "Monotonically increasing sequence number within the delivery plan."
    },
    "receipt_id": {
      "type": "string",
      "default": "",
      "description": "Unique identifier for this receipt record."
    },
    "event_id": {
      "type": "string",
      "default": "",
      "description": "The canonical event being delivered."
    },
    "delivery_plan_id": {
      "type": "string",
      "default": "",
      "description": "Identifier of the delivery plan this receipt belongs to."
    },
    "target_adapter": {
      "type": "string",
      "default": "",
      "description": "Name of the adapter the event is being delivered to."
    },
    "target_channel": {
      "type": ["string", "null"],
      "default": null,
      "description": "Target channel/conversation ID at the destination adapter."
    },
    "route_id": {
      "type": "string",
      "default": "",
      "description": "Identifier of the route that triggered this delivery."
    },
    "status": {
      "type": "string",
      "enum": [
        "queued",
        "sent",
        "failed",
        "dead_lettered",
        "cancelled",
        "abandoned",
        "suppressed"
      ],
      "default": "queued",
      "description": "Delivery evidence status; paired with receipt_kind."
    },
    "receipt_kind": {
      "type": ["string", "null"],
      "enum": ["attempt", "lifecycle", null],
      "default": null,
      "description": "Semantic evidence role. Omitted/null input is normalized from status at model construction; persisted rows are always attempt or lifecycle."
    },
    "error": {
      "type": ["string", "null"],
      "default": null,
      "description": "Error message if the delivery failed."
    },
    "failure_kind": {
      "type": ["string", "null"],
      "default": null,
      "description": "Classification of the failure (e.g. 'adapter_permanent', 'adapter_transient')."
    },
    "capability_level": {
      "type": ["string", "null"],
      "enum": ["native", "fallback", "unsupported", null],
      "default": null,
      "description": "Structured capability decision level copied from the delivery plan; null for receipts constructed without a plan."
    },
    "capability_field": {
      "type": ["string", "null"],
      "default": null,
      "description": "Capability or policy field that determined delivery, when applicable; event_kind identifies suppression of an unrecognized kind."
    },
    "capability_reason": {
      "type": ["string", "null"],
      "default": null,
      "description": "Human-readable capability decision reason. Display text only; consumers must not parse it for structure."
    },
    "delivery_strategy": {
      "type": ["string", "null"],
      "enum": [
        "direct",
        "fallback_text",
        "skip",
        "propagated",
        "opportunistic",
        "paper",
        null
      ],
      "default": null,
      "description": "Structured delivery strategy selected by the delivery plan."
    },
    "adapter_message_id": {
      "type": ["string", "null"],
      "default": null,
      "description": "Native message ID assigned by the target adapter after adapter-reported handoff, when available."
    },
    "next_retry_at": {
      "type": ["string", "null"],
      "format": "date-time",
      "default": null,
      "description": "Scheduled time for the next retry attempt, if applicable."
    },
    "attempt_number": {
      "type": "integer",
      "default": 1,
      "description": "1-indexed attempt number for this receipt. The first delivery attempt is 1. Durable ingress replanning preserves existing outbox generations and does not restart this number after a retry."
    },
    "parent_receipt_id": {
      "type": ["string", "null"],
      "default": null,
      "description": "Receipt ID of the preceding attempt in this delivery chain. None for the first attempt."
    },
    "source": {
      "type": "string",
      "default": "live",
      "description": "Dispatch mechanism that produced this receipt: live, retry, or replay.",
      "enum": ["live", "retry", "replay"]
    },
    "replay_run_id": {
      "oneOf": [
        {
          "type": "null"
        },
        {
          "type": "string",
          "minLength": 1,
          "pattern": "^\\S(?:.*\\S)?$"
        }
      ],
      "default": null,
      "description": "Replay-origin run ID. Valid on initial source='replay' evidence and later source='retry' evidence from the same replay-origin outbox; null for live lineage or unnamed replay."
    },
    "retry_max_attempts": {
      "type": ["integer", "null"],
      "default": null,
      "description": "Maximum total delivery attempts from the route retry policy, if applicable."
    },
    "retry_backoff_base": {
      "type": ["number", "null"],
      "default": null,
      "description": "Backoff base in seconds from the route retry policy, if applicable."
    },
    "retry_max_delay": {
      "type": ["number", "null"],
      "default": null,
      "description": "Maximum backoff delay in seconds from the route retry policy, if applicable."
    },
    "retry_jitter": {
      "type": ["boolean", "null"],
      "default": null,
      "description": "Whether jitter is enabled from the route retry policy, if applicable."
    },
    "rendering_evidence": {
      "type": ["string", "null"],
      "default": null,
      "description": "Serialized rendering evidence (JSON string) attached only on sent or queued deliveries. None for suppressed, rendering-failure, and adapter-failure receipts. Pre-outbox skip paths produce no receipt."
    },
    "outbox_id": {
      "type": ["string", "null"],
      "default": null,
      "description": "Internal correlation key linking this receipt to the durable outbox item tracking this delivery attempt."
    },
    "confirmation_level": {
      "type": "string",
      "enum": [
        "unknown",
        "local_queue",
        "local_transport",
        "remote_service",
        "end_to_end"
      ],
      "default": "unknown",
      "description": "Strongest delivery fact proven by the adapter or receipt; independent of lifecycle status."
    },
    "created_at": {
      "type": "string",
      "format": "date-time",
      "description": "Timestamp when this receipt was created (UTC, ISO-8601)."
    }
  },
  "additionalProperties": false,
  "allOf": [
    {
      "if": {
        "properties": {
          "source": {
            "const": "live"
          }
        },
        "required": ["source"]
      },
      "then": {
        "properties": {
          "replay_run_id": {
            "type": "null"
          }
        }
      }
    }
  ]
}
